{
  "policy_version": 1,
  "probe_image": "python@sha256:7ea3f82de8ea6d4fb7e5d2bbe3fe3c9d931700b7a529f1fe5769e42abe514ca1",
  "maximum_pids": 512,
  "forbidden_dns_names": [
    "api",
    "control-api",
    "evaluator",
    "postgres",
    "other-target",
    "docker",
    "host.docker.internal",
    "gateway.docker.internal"
  ],
  "direct_network_probes": [
    {"label": "external-https", "host": "1.1.1.1", "port": 443},
    {"label": "external-dns", "host": "8.8.8.8", "port": 53}
  ],
  "original_cve_targets": [
    {
      "target_id": "cve-original:CVE-2024-23897",
      "releases": ["vulnerable", "fixed"],
      "allowed_cap_add": []
    },
    {
      "target_id": "cve-original:CVE-2024-36401",
      "releases": ["vulnerable", "fixed"],
      "allowed_cap_add": []
    },
    {
      "target_id": "cve-original:CVE-2024-42009",
      "releases": ["vulnerable", "fixed"],
      "allowed_cap_add": ["CHOWN", "DAC_OVERRIDE", "FOWNER", "SETGID", "SETUID"]
    },
    {
      "target_id": "cve-original:CVE-2025-3248",
      "releases": ["vulnerable", "fixed"],
      "allowed_cap_add": []
    },
    {
      "target_id": "cve-original:CVE-2026-54433",
      "releases": ["vulnerable", "fixed"],
      "allowed_cap_add": ["CHOWN", "DAC_OVERRIDE", "FOWNER", "SETGID", "SETUID"]
    }
  ],
  "managed_defenses": [
    {
      "condition_id": "static-guard",
      "allowed_cap_add": [],
      "require_read_only": true
    }
  ]
}
